{
  "schema": "proofbound-runtime-authority-vector/1",
  "id": "closed-network-and-zero-output",
  "input": {
    "paths": [
      { "path": "/lib/ld-linux.so", "access": "execute", "role": "runtime-loader-executable" },
      { "path": "/bin/tool", "access": "execute", "role": "runtime-executable" },
      { "path": "/lib", "access": "read", "role": "runtime-library" }
    ],
    "environment": [],
    "limits": {
      "processes": 1,
      "wall_time_ms": 1,
      "stdout_bytes": 0,
      "stderr_bytes": 0
    },
    "network": "deny"
  },
  "expected": {
    "paths": [
      { "path": "/bin/tool", "access": "execute", "role": "runtime-executable" },
      { "path": "/lib", "access": "read", "role": "runtime-library" },
      { "path": "/lib/ld-linux.so", "access": "execute", "role": "runtime-loader-executable" }
    ],
    "environment": [],
    "limits": {
      "processes": 1,
      "wall_time_ms": 1,
      "stdout_bytes": 0,
      "stderr_bytes": 0
    },
    "network": "deny"
  }
}
